{
  "title": "Fancy Housemade Soda",
  "description": "Okinawa sugar and foraged rosemary meld together to yield a distinctly herbal, cola-like note in this house made aromatic soda. Skip the club soda and reach for a bottle of sparkling mineral water instead for a drink with boosted texture and mouthfeel.",

  "attribution": { "author": "Jordan Michelman" },

  "yield": { "quantity": 1, "unit": "pitcher" },

  "ingredients": [
    {
      "id": "syrup",
      "title": "Ingredients",
      "items": [
        { "name": "Fresh rosemary", "amount": 0.5, "unit": "cup", "scaleMode": "volume" },
        { "name": "Filtered water", "amount": 4, "unit": "cups", "scaleMode": "volume" },
        { "name": "Dark sugar (such as Okinawan black sugar, jaggery, or panela)", "amount": 2, "unit": "cups", "scaleMode": "volume" },
        { "name": "Good mineral water, to serve (like Vichy Catalan, Gerolsteiner, or if you absolutely must, Perrier)", "amount": 1.5, "unit": "bottles", "scaleMode": "whole_range", "display": "Bottle or two" }
      ]
    }
  ],

  "steps": [
    {
      "number": 1,
      "body": "Combine the rosemary, filtered water and sugar in a saucepan or Dutch oven. Bring to a boil, then reduce heat to simmer for 20 minutes.",
      "timer": { "id": "simmer", "label": "Simmer the syrup", "seconds": 1200 }
    },
    {
      "number": 2,
      "body": "Strain and decant into a sterilised jar."
    },
    {
      "number": 3,
      "body": "Serve over rocks with mineral water and add fresh fruit or additional herbs if desired."
    }
  ],

  "notes": [
    { "label": "Storage", "body": "Store the syrup in the refrigerator for up to 2 weeks." }
  ]
}
