{
  "title": "Fennel Pasta with a Chilli-Citrus Crumb",
  "category": "Dish",
  "description": "The caramelised fennel adds a mellow sweetness to this pasta recipe, while lemon zest and chilli add a little zing. Vegetarian.",

  "attribution": { "author": "Nadine Brown, Olive Magazine" },

  "servings": { "quantity": 2, "unit": "servings" },

  "times": [
    { "label": "Prep", "value": "15 minutes" },
    { "label": "Cook", "value": "50 minutes" },
    { "label": "Difficulty", "value": "Easy" }
  ],

  "ingredients": [
    {
      "id": "main",
      "title": "Ingredients",
      "items": [
        { "name": "Olive oil (2 tbsp for the fennel, 1 tbsp for the crumb)", "amount": 3, "unit": "tbsp", "scaleMode": "volume" },
        { "name": "Large fennel bulb, finely sliced (green fronds reserved to serve)", "amount": 1, "unit": "bulb", "scaleMode": "whole" },
        { "name": "Long shallot, finely sliced", "amount": 1, "unit": "shallot", "scaleMode": "whole" },
        { "name": "Garlic cloves, finely chopped", "amount": 2, "unit": "cloves", "scaleMode": "whole" },
        { "name": "Pine nuts", "amount": 3, "unit": "tbsp", "scaleMode": "volume" },
        { "name": "Thyme leaves (half for the fennel, half for the crumb)", "amount": 2, "unit": "tsp", "scaleMode": "volume" },
        { "name": "Short pasta shapes", "amount": 200, "unit": "g", "scaleMode": "weight" },
        { "name": "Dry white wine", "amount": 100, "unit": "ml", "scaleMode": "volume" },
        { "name": "Red chilli, finely chopped", "amount": 1, "unit": "chilli", "scaleMode": "whole" },
        { "name": "Panko breadcrumbs", "amount": 30, "unit": "g", "scaleMode": "weight" },
        { "name": "Lemon, zested", "amount": 1, "unit": "lemon", "scaleMode": "whole" },
        { "name": "Orange, zested", "amount": 0.5, "unit": "orange", "scaleMode": "whole" }
      ]
    }
  ],

  "steps": [
    {
      "number": 1,
      "title": "Caramelise the fennel",
      "component": "Fennel base",
      "body": "Warm 2 tbsp of the oil in a large frying pan, then fry the fennel and shallot with a pinch of salt over a medium-low heat for 40-50 minutes, stirring regularly, until the fennel turns a deep gold and is very soft, almost like a paste. Keep adding splashes of water or the pasta cooking water if it's starting to stick to the pan.",
      "timer": { "id": "fennel-caramelise", "label": "Caramelise the fennel", "seconds": 2700 }
    },
    {
      "number": 2,
      "title": "Cook the pasta",
      "component": "Pasta",
      "body": "While the fennel cooks, cook the pasta following pack instructions until al dente. Keep back a cup of the cooking water before draining."
    },
    {
      "number": 3,
      "title": "Add the aromatics",
      "component": "Fennel base",
      "body": "Once the fennel has caramelised, add the garlic, pine nuts and half the thyme, and fry for 1 minute.",
      "timer": { "id": "aromatics", "label": "Fry the aromatics", "seconds": 60 }
    },
    {
      "number": 4,
      "title": "Deglaze with wine",
      "component": "Fennel base",
      "body": "Pour the wine over the fennel and bring up the heat slightly. Bubble for a few minutes until evaporated while you make the crumb."
    },
    {
      "number": 5,
      "title": "Make the chilli-citrus crumb",
      "component": "Crumb",
      "body": "In another frying pan, heat the remaining 1 tbsp oil over a medium heat and fry the remaining thyme and the chilli for a few minutes until fragrant. Stir in the breadcrumbs and fold into the spiced oil for a few minutes until they start to turn a little golden. Transfer to a bowl and stir through the lemon and orange zests."
    },
    {
      "number": 6,
      "title": "Toss and serve",
      "body": "Tip the pasta into the fennel pan, with a splash of the cooking water, and toss well. Serve in warmed bowls with the crumb scattered over the top and the reserved fennel fronds."
    }
  ],

  "notes": [
    { "label": "Cook's tip", "body": "A mandoline will make short work of shaving the fennel as thinly as you can. When prepping, don't be too quick to discard the green fronds, which can be used as a garnish." },
    { "label": "Reader tip", "body": "One reviewer suggests using two large fennel bulbs next time, and adding a squeeze of lemon at the end to lift it." }
  ]
}
