{
  "title": "Home-Style Korean Round Cabbage Kimchi",
  "alternateNames": ["양배추 김치", "Yangbaechu Kimchi"],
  "description": "Kimchi is one of Korea's most treasured foods. More than 250 recognised varieties reflect different regions, seasons and family traditions. This home-style recipe brings that tradition to UK kitchens using everyday ingredients.",

  "yield": { "quantity": 2, "unit": "litres" },

  "times": [
    { "label": "Prep", "value": "45 minutes" },
    { "label": "Brine", "value": "1 hour" },
    { "label": "Ferment", "value": "12-24 hours" }
  ],

  "ingredients": [
    {
      "id": "binding-paste",
      "title": "Binding Paste",
      "items": [
        { "name": "Butternut squash, peeled, 2-3cm dice", "amount": 250, "unit": "g", "scaleMode": "weight" },
        { "name": "Glutinous rice flour (or 2 tbsp plain flour, or 1/2 cup blended cooked rice)", "amount": 2, "unit": "tbsp", "scaleMode": "volume" }
      ]
    },
    {
      "id": "cabbage",
      "title": "Cabbage",
      "items": [
        { "name": "Round cabbage, cut into 3-4cm pieces", "amount": 800, "unit": "g", "scaleMode": "weight", "display": "750-900g" },
        { "name": "Coarse sea salt", "amount": 75, "unit": "g", "scaleMode": "weight" },
        { "name": "Cold water", "amount": 1, "unit": "l", "scaleMode": "volume" }
      ]
    },
    {
      "id": "raw",
      "title": "Raw Ingredients",
      "items": [
        { "name": "Apple, julienned", "amount": 1, "unit": "medium", "scaleMode": "whole" },
        { "name": "Onion, coarsely chopped", "amount": 1, "unit": "medium", "scaleMode": "whole" },
        { "name": "Garlic cloves, finely chopped or grated", "amount": 8, "unit": "cloves", "scaleMode": "whole_range", "display": "7-8 cloves" },
        { "name": "Fresh ginger, finely grated", "amount": 1, "unit": "piece (5-10mm)", "scaleMode": "whole" },
        { "name": "Sweet pointed red peppers, finely diced", "amount": 2, "unit": "peppers", "scaleMode": "whole" },
        { "name": "Red chillies, finely chopped (optional)", "amount": 2, "unit": "chillies", "scaleMode": "whole_range", "display": "1-2, optional" },
        { "name": "Spring onions, cut diagonally into 2-3cm lengths", "amount": 4, "unit": "spring onions", "scaleMode": "whole_range", "display": "3-4" },
        { "name": "Carrot, coarsely grated", "amount": 1, "unit": "medium", "scaleMode": "whole" },
        { "name": "Sweet potato, coarsely grated (optional)", "amount": 200, "unit": "g", "scaleMode": "weight" },
        { "name": "Sugar", "amount": 1, "unit": "tbsp", "scaleMode": "volume" },
        { "name": "Fish sauce (or vegetarian fish sauce, or 4 tbsp light soy + 1 tbsp white miso)", "amount": 5, "unit": "tbsp", "scaleMode": "whole_range", "display": "4-5 tbsp" },
        { "name": "Gochugaru flakes (coarse Korean chilli flakes, optional)", "amount": 4, "unit": "tbsp", "scaleMode": "whole_range", "display": "2-4 tbsp" }
      ]
    }
  ],

  "steps": [
    {
      "number": 1,
      "title": "Make the binding paste",
      "component": "Binding Paste",
      "body": "Boil the squash until tender. Drain and blend until smooth, adding a little cooking water only if needed. Return to the pan. Stir in the chosen starch. Cook for 2-4 minutes until thick. Cool completely."
    },
    {
      "number": 2,
      "title": "Brine the cabbage",
      "component": "Kimchi Prep",
      "body": "Dissolve the salt in the cold water. Add the cabbage. Mix well. Leave for 1 hour, turning once or twice. Rinse well and drain for 15-20 minutes.",
      "timer": { "id": "brine", "label": "Brine the cabbage", "seconds": 3600 }
    },
    {
      "number": 3,
      "title": "Mix the raw ingredients",
      "component": "Kimchi Prep",
      "body": "Combine the cooled paste with all raw ingredients. If using gochugaru, leave for 20-30 minutes so the flakes hydrate and deepen in colour.",
      "timer": { "id": "rest", "label": "Rest the gochugaru", "seconds": 1500 }
    },
    {
      "number": 4,
      "title": "Coat the cabbage",
      "component": "Kimchi Prep",
      "body": "Add the drained cabbage. Fold and massage gently until every piece is evenly coated."
    },
    {
      "number": 5,
      "title": "Pack the jars",
      "component": "Kimchi Prep",
      "body": "Pack firmly into sterilised jars. Leave about 2.5cm headspace. Press down to remove air pockets and keep the vegetables below the liquid."
    },
    {
      "number": 6,
      "title": "Ferment",
      "component": "Kimchi Fermentation",
      "body": "Leave at room temperature for 12-24 hours. When small bubbles appear and the aroma turns lightly tangy, refrigerate. Start the fermentation tracker below once jars are packed.",
      "timer": { "id": "ferment", "label": "Ferment at room temperature", "seconds": 64800 }
    }
  ],

  "category": "Ferment",

  "fermentationTracker": {
    "stages": [
      { "id": "early", "label": "Fresh", "description": "Crisp and lightly fermented — still settling in", "fromDay": 0, "toDay": 2, "colour": "yellow" },
      { "id": "peak", "label": "Best window", "description": "Balanced, tangy, still crunchy — the best time to eat it", "fromDay": 3, "toDay": 14, "colour": "green" },
      { "id": "past", "label": "Past peak", "description": "More sour and softer, with possible slight bitterness", "fromDay": 15, "toDay": 20, "colour": "amber" },
      { "id": "avoid", "label": "Well past best", "description": "Very sour and soft by now — better used cooked into dishes like kimchi jjigae than eaten fresh", "fromDay": 21, "colour": "red" }
    ]
  },

  "variations": [
    { "name": "Traditional", "description": "Use napa cabbage or daikon and increase the gochugaru." },
    { "name": "Spring greens", "description": "Replace part of the cabbage with pak choi, mustard greens or spinach." },
    { "name": "Orchard", "description": "Add julienned pear and toasted sesame seeds for a sweeter, fruitier kimchi." }
  ],

  "notes": [
    { "label": "Storage", "body": "Refrigerate once fermented. Use a clean utensil and keep the vegetables submerged. Best enjoyed within two weeks for crunch and freshness." },
    { "label": "Serving", "body": "Serve with steamed rice, tofu, bibimbap, noodles, fried rice, Korean pancakes or grilled vegetables." }
  ]
}
