{
  "title": "Romesco Paella-Stuffed Tomatoes with Bravas-Style Jersey Royals",
  "description": "Large tomatoes stuffed with warmed vegetarian paella, feta and romesco, served with crispy baby Jersey Royals, roasted red pepper, red onion and garlic in a smoky-sweet romesco-bravas-style sauce. Finished with black garlic aioli and fresh basil. A one-jar leftover upgrade — V1 Final.",

  "servings": { "quantity": 2, "unit": "servings", "note": "today, with easy repeat for 2 more tomorrow" },

  "times": [
    { "label": "Prep", "value": "20-25 minutes" },
    { "label": "Cook", "value": "45-60 minutes total" },
    { "label": "Oven (potatoes)", "value": "200°C fan" },
    { "label": "Oven (tomatoes)", "value": "180°C fan" }
  ],

  "ingredients": [
    {
      "id": "tomatoes",
      "title": "Stuffed Tomatoes (for 2 today)",
      "items": [
        { "name": "Large tomatoes, hollowed (keep flesh and juices for sauce)", "amount": 2, "unit": "tomatoes", "scaleMode": "whole" },
        { "name": "Leftover vegetarian paella, enough to fill the tomatoes" },
        { "name": "Romesco", "amount": 1.5, "unit": "tbsp", "scaleMode": "whole_range", "display": "1-2 tbsp" },
        { "name": "Feta, crumbled", "amount": 40, "unit": "g", "scaleMode": "weight", "display": "30-50g" },
        { "name": "Dried oregano, thyme or mixed dried Italian herbs" },
        { "name": "Black pepper" },
        { "name": "Fresh basil, torn, to finish" },
        { "name": "Black garlic aioli, to finish" }
      ]
    },
    {
      "id": "sauce",
      "title": "Romesco-Bravas Sauce",
      "items": [
        { "name": "Scooped tomato flesh and juices" },
        { "name": "Olive oil", "amount": 1, "unit": "tbsp", "scaleMode": "volume" },
        { "name": "Butter (optional, a small knob)" },
        { "name": "Romesco", "amount": 3, "unit": "tbsp", "scaleMode": "volume" },
        { "name": "Sliced garlic flakes (half the batch below), or to taste" },
        { "name": "Chilli flakes, small pinch" },
        { "name": "Garlic powder, small pinch" },
        { "name": "Mixed dried Italian herbs, small pinch" },
        { "name": "Cider vinegar, a splash" },
        { "name": "Black pepper" },
        { "name": "Piri salt, tiny amount, only if needed" }
      ]
    },
    {
      "id": "potatoes",
      "title": "Jersey Royals & Vegetables",
      "items": [
        { "name": "Baby Jersey Royals, cut to 2.5-3cm pieces", "amount": 450, "unit": "g", "scaleMode": "weight", "display": "400-500g" },
        { "name": "Red pepper, medium-thin lengthways slices cut into 3-5cm lengths", "amount": 1, "unit": "medium", "scaleMode": "whole" },
        { "name": "Red onion, cut as a flower, kept together for slow roasting", "amount": 1, "unit": "onion", "scaleMode": "whole" },
        { "name": "Whole garlic cloves, skin on if possible", "amount": 6, "unit": "cloves", "scaleMode": "whole_range" },
        { "name": "Remaining sliced garlic flakes (other half of the batch above)" },
        { "name": "Olive oil", "amount": 1.75, "unit": "tbsp", "scaleMode": "volume", "display": "1.5-2 tbsp" },
        { "name": "Garlic powder" },
        { "name": "Mixed dried Italian herbs" },
        { "name": "Black pepper" },
        { "name": "Piri salt, very small amount" },
        { "name": "Chilli flakes, small pinch, added part-way through" }
      ]
    }
  ],

  "steps": [
    {
      "number": 1,
      "title": "Make and reduce the sauce",
      "component": "sauce",
      "body": "Warm the olive oil and butter gently. Add the tomato flesh and juices, half the garlic flakes, garlic powder, dried herbs, chilli flakes and black pepper. Cook covered for 5-8 minutes to soften, then add the romesco and cider vinegar. Continue low and slow until the colour deepens, breaking down larger pieces with a spoon or masher. Finish with the lid ajar or uncovered until spoonable rather than watery.",
      "timer": { "id": "sauce-simmer", "label": "Simmer the sauce, covered", "seconds": 390 }
    },
    {
      "number": 2,
      "title": "Start the potatoes",
      "component": "potatoes",
      "temperature": "200°C fan / 220°C conventional",
      "elapsedMinutes": { "from": 0, "to": 15 },
      "body": "Preheat the oven. Toss the Jersey Royals with olive oil, garlic powder, dried herbs, black pepper and a very small amount of piri salt. Spread in one layer, preferably cut-side down. Add the red onion flower and whole garlic cloves. Roast for 12-15 minutes.",
      "timer": { "id": "potato-roast", "label": "Roast the potatoes (first stage)", "seconds": 810 }
    },
    {
      "number": 3,
      "title": "Add red pepper",
      "component": "potatoes",
      "elapsedMinutes": { "from": 12, "to": 15 },
      "body": "Add the shortened red pepper strips after 12-15 minutes. This lets them soften and become part of the potatoes without collapsing too far. Keep the onion flower mostly intact."
    },
    {
      "number": 4,
      "title": "Add garlic flakes and chilli",
      "component": "potatoes",
      "elapsedMinutes": { "from": 22, "to": 25 },
      "body": "At around 22-25 minutes, add the remaining sliced garlic flakes and a small pinch of chilli flakes. If the garlic is very thin, add it for only the final 5-8 minutes. Aim for golden, not dark brown."
    },
    {
      "number": 5,
      "title": "Warm the paella for today only",
      "component": "tomatoes",
      "body": "Warm only enough paella for the tomatoes you are eating today. Heat with a spoonful of romesco or sauce, or a tiny splash of water, until steaming and piping hot. Do not warm the portion you plan to use tomorrow."
    },
    {
      "number": 6,
      "title": "Stuff the tomatoes",
      "component": "tomatoes",
      "body": "Mix the hot paella with 1-2 tbsp romesco, a spoonful of sauce if it needs moisture, some feta, black pepper and a pinch of dried herbs. Fill the tomato shells without packing too tightly. Top with feta, a tiny drizzle of olive oil and black pepper."
    },
    {
      "number": 7,
      "title": "Sauce-glaze the potatoes",
      "component": "potatoes",
      "elapsedMinutes": { "from": 30, "to": 42 },
      "body": "When the potatoes are nearly cooked, spoon over some romesco-bravas sauce and toss lightly so it coats the potatoes, peppers and roasted onion. Return to the oven for 5-7 minutes. Keep some sauce back for serving."
    },
    {
      "number": 8,
      "title": "Bake the stuffed tomatoes",
      "component": "tomatoes",
      "temperature": "180°C fan / 200°C conventional",
      "elapsedMinutes": { "from": 42, "to": 62 },
      "body": "Reduce the oven to 180°C fan. Put the tomatoes in a small dish with a spoonful of sauce around the base, but do not flood them. Bake for 15-20 minutes if filled with hot paella. They are ready when softened, the feta has caught slightly and the filling is piping hot in the centre.",
      "timer": { "id": "tomato-bake", "label": "Bake the stuffed tomatoes", "seconds": 1050 }
    },
    {
      "number": 9,
      "title": "Finish and serve",
      "body": "Spoon reserved sauce onto the plate. Add stuffed tomatoes and bravas-style potatoes. Finish with black garlic aioli, torn fresh basil, optional extra feta and black pepper."
    }
  ],

  "notes": [
    { "label": "Kitchen notes", "body": "Skip breadcrumbs — the potatoes provide crisp texture and feta gives salt and creaminess. Keep the sauce rustic: reduce and crush rather than fully blend. Cut the red pepper shorter so it integrates into the potato tray rather than becoming a separate side. Main jar opened: Romesco only." },
    { "label": "Storage & leftovers", "body": "Because the filling contains leftover rice, reheat only the portion you are eating and make sure it is piping hot before stuffing. Keep tomorrow's paella portion cold in the fridge and reheat it tomorrow only once, until piping hot. Store any extra sauce covered in the fridge and reheat gently. Hollowed tomato shells can be stored separately, covered and upside down on kitchen paper, then stuffed tomorrow." },
    { "label": "Flavour profile", "body": "Smoky-sweet from romesco, pepper and roasted onion; savoury from garlic and black garlic aioli; lightly sharp from cider vinegar and tomato; salty-creamy from feta; fresh from basil; and gently warm from piri salt and chilli rather than aggressively spicy." }
  ]
}
